{
    "meta_info": {
        "category": "研究进展汇报",
        "sentiment": "neutral",
        "tags": [
            "研究生",
            "图像识别",
            "实验分析",
            "中期汇报",
            "研究进展"
        ]
    },
    "core_event": "研究生在研究中期完成了100个Epoch的图像识别模型训练，并针对获取的result.csv数据中Loss下降但评价指标为0的异常情况，向导师准备汇报工作总结与优化计划。",
    "entities": {
        "people": [
            {
                "name": "研究生",
                "title": "研究人员",
                "stance": "完成全量实验迭代，分析result.csv数据，发现评估指标异常并拟定解决方案。"
            },
            {
                "name": "导师",
                "title": "指导教师",
                "stance": "听取中期实验汇报，针对数据异常及后续研究方向提供指导建议。"
            }
        ],
        "organizations": [
            "高校科研实验室",
            "计算机视觉研究团队"
        ]
    },
    "event_details": {
        "time": "研究中期（本周）",
        "location": "科研实验室",
        "key_data": [
            {
                "value": "100个epoch",
                "indicator": "模型训练迭代次数",
                "trend": "完成预设训练轮次"
            },
            {
                "value": "0.05202",
                "indicator": "最终train/box_loss",
                "trend": "从0.12988持续下降，收敛情况良好"
            },
            {
                "value": "0",
                "indicator": "评价指标(mAP/Precision)",
                "trend": "全阶段处于0值，判定为逻辑或标注异常"
            }
        ]
    },
    "analysis": {
        "background": "图像识别项目进入中期实验验证阶段，需要通过量化指标评估当前模型的特征提取与定位能力。",
        "impact": "通过分析发现模型在训练集上收敛但在验证集上无指标，可及时纠正数据集加载或类别映射错误，避免后续研究偏离方向。",
        "quotes": [
            "本周完成全部100轮模型迭代，获取完整result.csv数据",
            "实验显示Loss趋势符合预期，但评价指标异常需重点排查",
            "下周计划对验证集标注路径及推理置信度进行专项调试"
        ]
    }
}